{
  "schema": "cipherazzi.endpoint/1",
  "provider": "OpenSSL public-result adapter",
  "pid": 4242,
  "process_started_us": 1699999000000000,
  "handshake_started_us": 1700000000000000,
  "timestamp_us": 1700000000100000,
  "local": {
    "address": "10.20.0.1",
    "port": 52000
  },
  "remote": {
    "address": "10.20.0.2",
    "port": 443
  },
  "role": "client",
  "transport": "TCP",
  "success": true,
  "peer_verified": true,
  "tls_version": 772,
  "cipher_id": 4866,
  "signature_scheme": 2308,
  "server_certificates_der": [
    "MIITTTCCBkqgAwIBAgIUSyXn5peetnMmqen4vL/lTINMAeIwCwYJYIZIAWUDBAMSMBMxETAPBgNVBAMMCGF1dGgubGFiMB4XDTI2MTAwMzAwMTY0NVoXDTI2MTAwNTAwMTY0NVowEzERMA8GA1UEAwwIYXV0aC5sYWIwggUyMAsGCWCGSAFlAwQDEQOCBSEAqV4+98l6TnWS9npu9eBkvuGEMeKiRdX1GVsmfYkaKWDYtCkWhgpa6MRNTJxKPHxiAj3YcAkonV10s/PJBwgJPF8GTXuKZs/Ir9QowC6I+y2SDUK1vu0jaPDkz1TxXrT3BeSqhtSn5cWUUEd5ISaSVKXjqof/bSHjbVSXJpRWFZbiWn+kVK1i744Ldm4TfAtN7B0xRMKiqcjB13d5jIEfXqRhME2XKJm0oOYhRJW+v5daAkAZGAnoDDuN4q9/YDbBom2Yg78IV4Ql44xiGoEQ43g1l9wSl4/Yb9N5mMlS4QH0waDeOGwyeaurmRp70KxVzqRFtp24gL5ayE6d/RRF2c+8VYaG12KzTYYMOadYEET5dLRbsGw/BSweITnXgh6oLGQLP1oErqmLxEBSNmK+Ky4E/qtXHTcY4v1fSMReQnbtnk0yWrok2157prDja+6sWdr6OSDNx+8102NfWY1Qbg51E0AlDSCYGujNvgFVZJzFge0b1vP8TwGZcsZwp1ntthQNumL7qlxWmv9mfvaJ+YZPSPEBHCiDI9oQtH7OWPDz8VihRJbJ0+TvOFwizMu/jMLXvtVTNJI2QJWDWsutyUgq4s2oghy9NTh2dhcBa0Pr5DaF06F6MmYJfzScDeC/DuSA09Xakxb0U2O0Uk9lljLa68a5wkigMW424haO90iBSW9c3mjaKYpUW5f/OhPcOB9pkfLyaEBsqfIKxNjebmYIGQg+hsxWAiKy8mM2TqPQ5u4KL+vzzTk/QIKJ5X5QDp2SwKhpu6uuF3HnbabqaY0laOXgbqrfq+Z5+joYagPPo6Qfu3WfOEzMu+yRHuJ8XTkGBIMMF1ZfZCEEopI2WNuZz6PZJTcDJcBXzP8N/0cDVzXXSadcqC75g1RpSI4jqO22QBrsg9g1MHLDiUhKVnihAHZKML2L/IFlKjiYicV/FZM3cgen1E8EpORh2l+MYz9aecYwV68wxBQFk4teEOUTraOTEXU5cOB2YMakMLtRar6GTco1bmSGY6D2hDg9lk07Tz9kkLPMcCKMteEhNYy2eB4BgUZOgoo2HE4ouaLOlJkO0CXVrfii2gkoFEqvDuTJTjfW29SSjjIPAJFwV+eijM3M3DvyBOHWiWjF6PDtJOjlRbHeAEh2VM+q90WpqQXYNfa24eCJ31WmCT7B3E/dj6hAWez685Zs9N6uxCkDt1F28CvQvlTAt0arF47TKCFUL0xva46sEW6YaBupvUIM+uwfdVyMFfvZd/MdKsWpNclEIpqXV70BaeiTYvsuvpikYKiDpA0IQOeKief+w/4z/5ZDkLuSnwxMYqkCEeB+NDq9KO8tieaaO4mWye8p6+xP5YU8FMKNB7Q5VsqL1IU7vIeEyQXUtEj836iOmRgfK2jXQkGE/IIcBEkvqP4bEEtiZZNbYuEZSb6f1gurSJ3A+BqYYIVzRkUxB1ERK74Q8p1m/mSErenZ0rqOQvRGQG0VLH6o1ZlANWGF4NAibmErNx997kI9sOMaz2YfM8yY5MyNkyIGFrxOexUV0xvJ3WwMqVG+XvU2x3UlmT3o1umkO7LXQEf/zUg8TJPZtLa6VVad9d3lm9y+JeGYyT7VijEbdGoFeJbeGEgs+Brz3UjzsmxZ6+KdizY/wyI5l8caHvSXXlEbmhdjo5Y2WqYIeQIH25Ry0Zhku7M6wltKA99y0R3i/wRzHA3Mf9B7NHaBSb8Qd1qb3Z2o/YWSFQPLlcMuEtNz+VLsmdmp7rJIMKOBnzCBnDAMBgNVHRMBAf8EAjAAMA4GA1UdDwEB/wQEAwIHgDAdBgNVHSUEFjAUBggrBgEFBQcDAQYIKwYBBQUHAwIwHQYDVR0RBBYwFIIIYXV0aC5sYWKCCHF1aWMubGFiMB0GA1UdDgQWBBSUjPDelSTkAXlDNOakEj3DfReRHjAfBgNVHSMEGDAWgBRuBOdOm0uZJS+7+ER7754ruZgAfjALBglghkgBZQMEAxIDggzuAKdgpp5slN8gSgl75giQOWu2SY5ZUG7tCQGybdnqwGqAa099uGrPm5pSq5E/rEWlEGqYJt/9oToYTWBSg5iS+d92Q0LVegvGWWVLXxwwBrXYqoX1bFIxsgU0yIJJf+0ognY8Zq9nl+gV6r1S2q0kdqEwNinh8C1p55pGAIYgt2SPnWgJCrf6VA/M5M5xkkP5j9TOFp+WdtDNDQAX0dJfep17JuoWNr/o3y61EbRK+L+/bc7oO+gBVQTUDoAL17+PgJcueDyHP+kjl06MxcWgc6CZcBjb1KYkJdpPpKwlZ0mSn67rCY23b+2zgIgrIl3EzQ+L6fMMxzkQfzCWkJP9TpBkpn5N3fnkv4G1JbCypTHaqbEvUOev8j+WwWrSep3pxU0/I+431UtOcWjoxuwavu3qsQy+sQBsfvsR9DU6XOwoqFGdoNZaPW0erimTD0ZXDDBDITuoP41XkQ52TAmxzu4i5rfx8Jg7oFVR18eGSzPeQYu3Ry0fxTiDhyaZugLyZzP2OUeFaCV29+/boDu03Q/BEol5fY8uj83A7/JX7nN3BA9i7o0EOKyI/iMWU/r/QAhenCm807J5d2Lpjm2/1eQaTqBDyM3ppLwxTWEyGgwaDlB4DsTwUiVGLEOzAMQj3gFdYQPcj1KbU0mSCtVTVxAT43csBlavk/yN7dqWH+6cxQB1HfMSDoEa6gar1kwuWfg1VBCMLtriG/VeDN6wTTpN/rgcvyUiDh/JaV8aSwy9OlF3LTb2+c64eIi/Vp+OvFn2HjlHbeG21MSy6AsyVOgFYr0jH+Irexp0ufq4LnTYFBYTwSyAEIKn2BH/986+PNEc9PYlKjri0QH4nuLPNslHiT3lRpMDLv92p9uZwTrQeaZOFzj8BMmjudQSaphxLZm2ZezYWDukvBZrDMWWHR+HC37AkgqTtor3V689Dv60rhvl9ZZFZk01tqfwBjD+FiSGDlBuHnjqmLolCpVYjIrk0wNgJOvB/Qe+QhQ+qYLLBdd43Jn5KXtzYDmGUt4ES6ZSNEjUJrAb/ms1tUYStglDtr59hooPOFWDX9xCBQi6l/DEKDDr+8NopKOtlrD7lRXhBX16QoNCu8kNaA3gqot1+7JuYVwmn6/36tI7ycO3GGAJiR4PhAkQOuNwlm9M6OvDdeH9rfFAgg09yFhLvvO84pZd+JuxJn7XO4Hlbc/rGXODwE9M2XrPc0oC8r4IyMO4A4TLU7FqU8IVte0pWz6ZFdNHPuC1GcN6MvSEW2G6MrPQ3nA8hgnajsUCJTcoKtqApjbJm5xb02FdbbCT4ykZP8f32ldeZhbuw9r10eRRZhUYvp8rUVmq8NMPV7WQIE3ZOYiO66ksyaqokHoKbOknCcscGlPtaopbaItPtF8sbsueHCwFxW6xmX8FRTo+2cQj4xL9ZotJIqEqTUKwMyxG6tyvUKVDVGcz+p+lk24s9f98Dz41Dr+HoCi1jL4xft+Sc1/vz0TBsUgDMWPNBpOig2D9AuSXNjIpUM0586YbGYdP5QKLRferhLBKdkHsZIgGJ6b+YitGKTixcEAPs9yI0RSW4Oar1EiL7a4ZR8+EjWr3etVn5f8BEDOlUtIJxSaWuBlHygnEdyvCOZtJIX0o0t4tsuwfcTvXPYRqhzbDFmzC1gGC3+XoG1iwcnr5YB4BygJlJm8Ji2N8HbCXQfy8kgi3/JAliAjw1ZACCQKRwQjCElXtuoFnJ6X+5uZ9Tv1LaFh/zHZ3VaKuot7CEq0WdlAkC+thgt43UPMF/4Xw4BJppgP/ex1BTE7prk9W0nmaMhoUq0Lv1GytXSQRj7dP2SEsQQNFlVOiUk7SC8G3AVdGRmWcjMmg7KhzMN4oaV1yvBYOg5a2PgkH29u7xQKEQkey9aPMcosi6yxyoyNUkAAPHPivfqujEZ5bzgnoO8k16AnUnXlzF1dGXXg6gSam879KAoHLdR5+94Osn/qxctFUzxkvNJZXXpCEXXUEqarrifelciie69yXtU0MhzlNmsNUfIrd/iHMYvR4mX8jRFYeYO6Da0/jneu46N8Wcejqu3XgYXyYIS0+KjjJDWv5LhhiFz/ogJtK4cs1T2bEtpJ+yVyBwxUPQ3bd9U7cL4cj5R8juLehHB+Ne+L6g1XJNNum2dNi9PAhzneInY/+GJdkQy6RBIdadfYqfXixc1rOtZ/3DSTUgFYN7/LT61c4yhKcAdmIRYFZWSoGMu9aQLYYpoQFHLhv/tnTn5e/7z2aMvszFgR9U+YGQ/67d+g5hWo0OVzcgP4cKbSz0qJsVRb49dQ1Omealz975NIpvx5zzPxHim26Mf+hgdRDrDNY9QJpIDJ6woFEwk6MBUWZrlGZsUGG/NheQuGBF8ZLrA1jZEDcXE3MfGhZQ5MrPSholl8bv9vm7wus7yxWHDDJmP4we7rAtcgiKk4FyJpGnEZzupC+naJUVafyNYJ+/9JhHEWhanXCjaLZM4NcPcxgMAFXq+xZIJXe1KUyWb/dmX7fari5COIm4QFwjuF59SYTv498rxm1pF36oATzm32MaNCRxAGdW4/kqwrpRsw70erJCL0YYMNkqPcZD3CsUVviP3OVfXOmSFNdONi4HI+tiq5l9mf/UEdb/S6KCBVGSsxho+iwL7R3ZGWEikquWVHBoLHrShdQg9iI+faWzNqIqGwtrCEyQo57S/6DFmY3smGnz6xMwqynI4K1zhhg0KFq0aVQEDJCbBR+xwE38RekU+WAOdhtBxbritFyLKFFRruS6iu7t9ilfmirqQ8lDUo5GE/AWIBV12RWCNp2yMEp6Q/09ihrTTPHn1aOsdPk/c+4OizGLkDHju9hOxzCCW7i8HQMrY+25vXmKwdPR+i6/KhVEr7LhzwCBbK0OMAx0kLKFkFX3iInr5XRSg15JnQcvV7GGDSSf5ER2INBq0ROx0zkdQqNQPWNU7tPeVj9sgCeNCqVOatDskSf5gADKoEBzcWn4v3PCaZUvMm2pysn/a4w3QgpHASjeWE+NxVKt2B1xEq0gJwkrX7EYcI44JrrP7a/4x9/vkEeFoX88SZ/JqF53WoPIOwuUly1+SSWPyl3Cbh8rKa+Mp9vTNfRKwKejOkMoPsOdv/aMl82yHhMwcNbVNrkpqtAeKELWBYjAI3xC9Qk/wLYBpN/eN8lDI+Ax+Z3hTQVAwmloKqP1Hhr3qhzb3RqWUs1CrZWqzoPqxkHxfGnjJ5PcdjLH7zDCkX0BjNSW/jjnPW94Arbq5QKyygA5LqkYGUMkSGCigvb27WOoabZpt4Zh7FpEYdkPi0VjazV5eeyoKr5/rvuW1gEyEKyP7PCv8P4MH7mu/BtlRLC1/9u0mEqR8H7JFG3kE3qpj8dLNI9hvRIF2PksIsZazPZVsU7EoxfCUWn5PaLt/AVbJNjL4K3d7ic04sdD1M+pEG0t8uEmas6NDksJJ2KaTeEoH1w19AT1D8FmWHPy2KKVbIN5d8eqNWBGCpQuD6PZjZ/Je4u7PLisEKl5Mz0i/aKzFjv3MUTQ26Kx8fmuOq4CBOxW0XSu8bEFMVeLMhg+uxMxkAVsdnqWMfzmlHjPkvzqu/idR5foV8fkjWj+Yn8SrquBgGJ+4pFRXz+g1FKLMjV5kgl7VAoPwFScMtB8w35DKnTZTUQy6hUKNxmIHZfg0zhgU67ATMFHz+0kQQJt+oHb6MHBWbmCbGy+5xraKpkZJMasSZka3eQpwSDc0ReesKK1hw6AfRZ+kAH6qifTQHcX7vVbXeEM7R/nVYh8gxxmhkR8iERGIlnTQCpx5ntLYU7IqXf9/nv7q5uHB7OcnRK55a227oOntWc+T8Rqx6gUgiDu03anxUd+yTyGrVGzLWzY6J0GVr41gBlBLcYcMUSEPU6mlr3UtjcRXw9MUZZqlGzYis210hkhCdk6iJCLxfrwBn16umAgvbzhaYwTDC+G7qDAHQ2G9nXEQ6YZyGc2t3XEkoqf79ai8cFrBdFa5zHZDevE6bx5ntBocADk0yPekicdmRZNb8nsucV8YK5ylmmlrnlmBEterJNJmk+JqPqAgpIGfRT0bJJLZt4ZRcZYSa9mPUw415Za/35WFl5Y3DryXwRjfASfPSJObsbokl+wdoV/Kz/S/d+MowZppuD9v5nisTwWzj3eZOAJpsE4CazZLxqKJoG/o0SJ1EIcGYOGKJfJUZQJFnMvUANlUptMElaapEuNvrcrClqN8ANqwKqHpYujSUK686ZjYEz2FJwz6KZcnLpBXzA7NoEvW5AHkPolHyyXO2hTlIdBg4Ao/xECKZEPzFwe9gr6PKwUViFFYyVhRlqKuOR1nsT757+0w7zjJZq9gtyTpVcjrD19wAGKkOBkdP3HDF9q7nC1vwzfNnb6/v+S1p5k6ms19gAAAAAAAAAAAAAAAAAAAAAAAAAAAQMFBsjIw==",